{
  "$schema": "https://json-schema.org/draft/2020-12/schema",
  "$id": "https://schemas.socioprophet.dev/tritrpc/node-reputation.v0.schema.json",
  "title": "NodeReputation v0",
  "description": "Anonymous-but-transparent reputation for a mesh node — the admission gate that decides which nodes may ENTER the trusted set the Mesh Coordinator checks. Renders the Trust Equation (credibility/reliability/intimacy over self-orientation) plus an energy spectrum (knowledge/creativity/civility) and an observation history with time-decay. A pseudonymous node_ref carries reputation without identity. Admission is decided fail-closed by reference/node_admission.py.",
  "type": "object",
  "additionalProperties": false,
  "required": ["node_ref", "attestationRef", "region", "trust", "energy", "history"],
  "properties": {
    "node_ref": { "type": "string", "pattern": "^node://" },
    "attestationRef": { "type": "string", "minLength": 1, "description": "attestation the node presented (TPM quote etc.)" },
    "region": { "type": "string", "minLength": 1 },
    "trust": {
      "type": "object",
      "additionalProperties": false,
      "required": ["credibility", "reliability", "intimacy", "selfOrientation"],
      "properties": {
        "credibility": { "type": "number", "minimum": 0, "maximum": 1 },
        "reliability": { "type": "number", "minimum": 0, "maximum": 1 },
        "intimacy": { "type": "number", "minimum": 0, "maximum": 1 },
        "selfOrientation": { "type": "number", "minimum": 0, "maximum": 1, "description": "Trust-Equation denominator — HIGH self-orientation lowers trust." }
      }
    },
    "energy": {
      "type": "object",
      "additionalProperties": false,
      "required": ["knowledge", "creativity", "civility"],
      "properties": {
        "knowledge": { "type": "number", "minimum": 0, "maximum": 1 },
        "creativity": { "type": "number", "minimum": 0, "maximum": 1 },
        "civility": { "type": "number", "minimum": 0, "maximum": 1 }
      }
    },
    "history": {
      "type": "object",
      "additionalProperties": false,
      "required": ["observations", "decayHalfLifeDays"],
      "properties": {
        "observations": { "type": "integer", "minimum": 0, "description": "settled/verified interactions backing the scores." },
        "decayHalfLifeDays": { "type": "number", "exclusiveMinimum": 0 }
      }
    },
    "sentiment": { "type": "number", "minimum": -1, "maximum": 1, "description": "optional anonymized sentiment signal." }
  }
}
